Date,Time,State,District,Location,Description,Killed,Injured,Killed_Details,Injured_Details,Other_Details
2025-08-03,Not specified,Odisha,Sundargarh,Not specified,CPI-Maoist landmine,1,1,Railway trackman Etawa Oram 37,another severely injured,
2025-08-03,Not specified,Jharkhand,Not specified,Not specified,CPI-Maoist IED damaged rail track,0,0,,,
2025-08-04,Not specified,Chhattisgarh,Bijapur,Forested area near Pujarikanker village under Usoor Police Station,CPI-Maoist pressure IED,0,1,,50-year-old villager,Serious injuries
2025-08-05,Not specified,Chhattisgarh,Bijapur,Bastar division,CPI-Maoist IED,0,1,,Man,
2025-08-08,Not specified,Jharkhand,West Singhbhum,Saranda Forest area,CPI-Maoist IED during search,0,2,,CoBRA jawans 209 CRPF Battalion multiple injuries,
2025-08-18,Not specified,Chhattisgarh,Bijapur,Indravati National Park area,CPI-Maoist IED,1,3,Chhattisgarh Police DRG jawan,3 personnel injured,
2025-10-09,Not specified,Chhattisgarh,Bijapur,Pidia village under Gangaloor Police Station,CPI-Maoist IED,0,1,,Boy,
2025-10-10,Not specified,Chhattisgarh,Bijapur,Bastar division,CPI-Maoist IED,1,2,CRPF Head Constable,2 others injured,
2025-10-11,Not specified,Chhattisgarh,Bijapur,Pujarifode area under Gangalur Police Station,CPI-Maoist IED during patrol,0,1,,CoBRA commando,
2025-10-28,Not specified,Jharkhand,West Singhbhum,Digha village under Jareikela Police Station,CPI-Maoist IED,1,0,10-year-old tribal girl Siria Herenz,,
2025-11-08,Not specified,Chhattisgarh,Bijapur,Bastar division,CPI-Maoist IED,0,1,,CRPF handler Sumith M splinter injuries,1 CRPF K9 Stunner killed
2025-11-09,Not specified,Chhattisgarh,Sukma,Forested hills near Gogunda under Fulbagdi Police Station,CPI-Maoist IED,0,1,,CRPF trooper,
2025-11-14,Not specified,Chhattisgarh,Bijapur,National Park area,CPI-Maoist IED during encounter,0,1,,STF soldier,
2025-11-28,Not specified,Jharkhand,West Singhbhum,Kolbhonga Forest area in Saranda Forests Range under Jaraikela Police Station,CPI-Maoist IED,1,2,Girl,2 women seriously injured,
2025-12-14,Not specified,Jharkhand,West Singhbhum,Saranda Forest,CPI-Maoist IED blasts separate,0,2,,CoBRA personnel critical,
2026-01-05,Not specified,Chhattisgarh,Bijapur,Korcholi Nadipara,CPI-Maoist pressure IED,0,1,,15-year-old boy Ram Potam,
2026-01-18,Not specified,Chhattisgarh,Bijapur,Kasturipad village,CPI-Maoist IED,1,0,Young villager,,
